{
  "name": "srs",
  "displayName": "Spaced-repetition flashcards",
  "description": "Add a spaced-repetition flashcard deck (SM-2-lite scheduling, localStorage-persisted) for memorization lessons. Ships an author-editable <Flashcards> component into src/lesson/srs — no new npm dependencies.",
  "runtime": {
    "copy": [
      {
        "from": "runtime/srs",
        "to": "src/lesson/srs"
      },
      {
        "from": "examples",
        "to": "docs/examples"
      }
    ]
  },
  "skill": {
    "reference": "skill/pack.md",
    "loadWhen": "the goal is memorization/recall — vocabulary, facts, formulas, dates — and the learner benefits from spaced retrieval"
  },
  "quality": "quality.md"
}
