{
  "name": "tutor",
  "displayName": "Grounded AI tutor (durable)",
  "description": "Embed <Tutor> from @faraday-academy/tutor and a durable Vite + Nitro + Workflow server (author-editable api/ + workflows/). Grounded, Socratic, survives refreshes/timeouts. Needs AI_GATEWAY_API_KEY in .env.local locally; OIDC on Vercel.",
  "default": true,
  "runtime": {
    "dependencies": {
      "@ai-sdk/workflow": "^1.0.11",
      "@faraday-academy/tutor": "0.1.0",
      "ai": "^7.0.11",
      "nitro": "3.0.260610-beta",
      "workflow": "^4.5.0",
      "zod": "^4.0.0"
    },
    "cssImports": ["@faraday-academy/tutor/styles.css"],
    "copy": [
      { "from": "runtime/api", "to": "api" },
      { "from": "runtime/workflows", "to": "workflows" },
      { "from": "runtime/vite.config.ts", "to": "vite.config.ts" },
      { "from": "runtime/tsconfig.node.json", "to": "tsconfig.node.json" },
      { "from": "runtime/env.example", "to": "env.example" },
      { "from": "runtime/tutor.md", "to": "docs/tutor.md" },
      { "from": "examples", "to": "docs/examples" }
    ],
    "appends": [
      {
        "to": "pnpm-workspace.yaml",
        "marker": "nodeLinker",
        "text": "\n# Tutor: flatten node_modules so the Workflow step bundler resolves ajv's\n# dynamic requires in dev (nested .pnpm paths otherwise 500 the model step).\nnodeLinker: hoisted\n"
      }
    ]
  },
  "skill": {
    "reference": "skill/pack.md",
    "loadWhen": "the lesson should answer learner questions from its own content — a grounded, Socratic chat tutor beside the material"
  },
  "quality": "quality.md"
}
