{
  "name": "kids",
  "displayName": "Kids / tablet game",
  "description": "Preset for young learners on a tablet — one idea per screen, big touch targets, drag/sketch interaction, visible celebration, CRA sequencing. Skill-only: composes <SketchPad> + <Challenge> + <Paged> and leans on the audience pack's CRA row. No new deps.",
  "default": true,
  "runtime": {},
  "skill": {
    "reference": "skill/pack.md",
    "loadWhen": "the learner is a young child on a touch device — build a game-like, one-idea-per-screen tablet lesson"
  },
  "quality": "quality.md"
}
