{
  "name": "sim2d",
  "displayName": "2D simulation stage (SVG + GSAP)",
  "description": "Educational 2D simulations in a Workbench — SVG diagrams driven by formulas, GSAP timelines, and sim clocks. Replaces the old runtime motion hooks (useRafLoop/useSvgDrag). Author-editable glue copies into src/lesson/sim2d.",
  "runtime": {
    "dependencies": {
      "gsap": "^3.15.0"
    },
    "copy": [
      {
        "from": "runtime/sim2d",
        "to": "src/lesson/sim2d"
      },
      {
        "from": "examples",
        "to": "docs/examples"
      }
    ]
  },
  "skill": {
    "reference": "skill",
    "entry": "SKILL.md",
    "loadWhen": "the lesson needs a formula-driven 2D simulation or explanatory SVG animation inside a Workbench (kinematics, vectors, waves) — not a Pixi game stage"
  },
  "quality": "quality.md"
}
